{
  "schema": "witsoc.capability-manifest.v1",
  "owner": "frame",
  "version": 3,
  "capabilities": [
    {
      "id": "target-control",
      "summary": "Freeze identity, intent, constraints, and a replayable frontier.",
      "modes": ["*"],
      "roles": ["explorer"],
      "default": true,
      "triggers": [],
      "inputs": ["witsoc.request.v2"],
      "outputs": ["witsoc.target.v2", "witsoc.frontier.v2"],
      "requires": [],
      "load": [],
      "commands": ["bash \"$WITSOC_ROOT/scripts/witsoc.sh\" orchestrator-preflight --help", "bash \"$WITSOC_ROOT/scripts/witsoc.sh\" start --help"],
      "cost_class": "tiny",
      "priority": 100
    },
    {
      "id": "explorer-reasoning-control",
      "summary": "Compile target ambiguity, source coverage, a typed frontier DAG, route memory, and return arbitration into one bounded Explorer state.",
      "modes": ["OPEN_DISCOVERY"],
      "roles": ["explorer"],
      "default": true,
      "triggers": [],
      "inputs": ["witsoc.target.v2", "witsoc.frontier.v2", "witsoc.research-delta.v2", "witsoc.round-delta.v1", "witsoc.source-map.v2", "witsoc.obstruction.v2"],
      "outputs": ["witsoc.target-acceptance.v1", "witsoc.discovery-proposal.v2", "witsoc.explorer-contract.v1", "witsoc.explorer-state.v1", "witsoc.explorer-arbitration.v1"],
      "requires": ["frozen target and current replayable kernel state"],
      "load": ["references/explorer_reasoning.md"],
      "commands": ["bash \"$WITSOC_ROOT/scripts/witsoc.sh\" source-map-draft --help", "bash \"$WITSOC_ROOT/scripts/witsoc.sh\" source-map-check --help", "bash \"$WITSOC_ROOT/scripts/witsoc.sh\" explorer-proposal-draft --help", "bash \"$WITSOC_ROOT/scripts/witsoc.sh\" explorer-proposal-check --help", "bash \"$WITSOC_ROOT/scripts/witsoc.sh\" explorer-draft --help", "bash \"$WITSOC_ROOT/scripts/witsoc.sh\" explorer-check --help", "bash \"$WITSOC_ROOT/scripts/witsoc.sh\" explorer-stop-review-draft --help", "bash \"$WITSOC_ROOT/scripts/witsoc.sh\" explorer-stop-review-check --help", "bash \"$WITSOC_ROOT/scripts/witsoc.sh\" explorer-arbitrate --help"],
      "cost_class": "tiny",
      "priority": 99
    },
    {
      "id": "source-control",
      "summary": "Bind source claims and separate known, conditional, disputed, and open status.",
      "modes": ["SOURCE_SYNTHESIS"],
      "roles": ["explorer", "researcher"],
      "default": true,
      "triggers": [],
      "inputs": ["witsoc.target.v2"],
      "outputs": ["witsoc.source-map.v2", "witsoc.obstruction.v2"],
      "requires": [],
      "load": [],
      "commands": [],
      "cost_class": "small",
      "priority": 90
    },
    {
      "id": "reasoning-control",
      "summary": "Bind one episode to a compact claim graph, bounded alternatives, and outcome gates.",
      "modes": ["OPEN_DISCOVERY"],
      "roles": ["researcher"],
      "default": true,
      "triggers": [],
      "inputs": ["witsoc.target-acceptance.v1", "witsoc.research-episode.v1", "witsoc.reasoning-contract.v1"],
      "outputs": ["witsoc.reasoning-state.v1"],
      "requires": ["sealed episode-specific reasoning contract"],
      "load": ["references/researcher_reasoning.md"],
      "commands": ["bash \"$WITSOC_ROOT/scripts/witsoc.sh\" reasoning-check --help"],
      "cost_class": "tiny",
      "priority": 100
    },
    {
      "id": "frontier-control",
      "summary": "Arbitrate a diverse portfolio and issue one episode or STRONG independent round.",
      "modes": ["OPEN_DISCOVERY"],
      "roles": ["explorer"],
      "default": true,
      "triggers": [],
      "inputs": ["witsoc.target.v2", "witsoc.frontier.v2", "witsoc.discovery-proposal.v2", "witsoc.explorer-state.v1", "witsoc.explorer-arbitration.v1", "witsoc.research-delta.v2", "witsoc.obstruction.v2"],
      "outputs": ["witsoc.research-episode.v1", "witsoc.round.v1", "witsoc.decision.v2"],
      "requires": [],
      "load": [],
      "commands": ["bash \"$WITSOC_ROOT/scripts/witsoc.sh\" orchestrator-next --help", "bash \"$WITSOC_ROOT/scripts/witsoc.sh\" campaign-audit --help", "bash \"$WITSOC_ROOT/scripts/witsoc.sh\" source-map-check --help", "bash \"$WITSOC_ROOT/scripts/witsoc.sh\" explorer-draft --help", "bash \"$WITSOC_ROOT/scripts/witsoc.sh\" explorer-check --help", "bash \"$WITSOC_ROOT/scripts/witsoc.sh\" episode-plan --help", "bash \"$WITSOC_ROOT/scripts/witsoc.sh\" orchestrator-handoff --help", "bash \"$WITSOC_ROOT/scripts/witsoc.sh\" orchestrator-round-handoffs --help", "bash \"$WITSOC_ROOT/scripts/witsoc.sh\" finalize --help"],
      "cost_class": "small",
      "priority": 95
    },
    {
      "id": "deep-attack",
      "summary": "Attack one named obstruction and return a candidate frontier delta.",
      "modes": ["OPEN_DISCOVERY"],
      "roles": ["researcher"],
      "default": true,
      "triggers": [],
      "inputs": ["witsoc.research-episode.v1", "witsoc.reasoning-state.v1", "witsoc.obstruction.v2", "witsoc.source-map.v2"],
      "outputs": ["witsoc.research-delta.v2", "witsoc.candidate.v2", "witsoc.obstruction.v2"],
      "requires": ["validated reasoning state"],
      "load": [],
      "commands": [],
      "cost_class": "medium",
      "priority": 90
    },
    {
      "id": "artifact-control",
      "summary": "Produce or repair one checkable artifact without changing the target.",
      "modes": ["ARTIFACT_PRODUCTION", "REPAIR"],
      "roles": ["generator"],
      "default": true,
      "triggers": [],
      "inputs": ["witsoc.target.v2", "witsoc.research-episode.v1", "witsoc.obstruction.v2"],
      "outputs": ["witsoc.candidate.v2", "witsoc.obstruction.v2"],
      "requires": [],
      "load": [],
      "commands": ["bash \"$WITSOC_ROOT/scripts/campaign.sh\" --help"],
      "cost_class": "small",
      "priority": 90
    },
    {
      "id": "evidence-admission",
      "summary": "Derive checks from receipts and project reducer-owned status into the kernel.",
      "modes": ["CLAIM_VERIFICATION", "ARTIFACT_PRODUCTION", "REPAIR", "OPEN_DISCOVERY"],
      "roles": ["explorer"],
      "default": true,
      "triggers": [],
      "inputs": ["witsoc.candidate.v2", "witsoc.receipt.v2", "witsoc.research-delta.v2"],
      "outputs": ["witsoc.admission.v2"],
      "requires": ["independent actor identity when the requested status depends on independence"],
      "load": ["references/verification_interface.md"],
      "commands": ["bash \"$WITSOC_ROOT/scripts/witsoc.sh\" import-admission --help", "bash \"$WITSOC_ROOT/scripts/witsoc.sh\" review-draft --help", "bash \"$WITSOC_ROOT/scripts/witsoc.sh\" review-check --help"],
      "cost_class": "small",
      "priority": 85
    },
    {
      "id": "bridge-mesh",
      "summary": "Negotiate typed cross-capability messages and preserve causation.",
      "modes": ["CROSS_DOMAIN"],
      "roles": ["explorer", "generator", "researcher"],
      "default": true,
      "triggers": [],
      "inputs": ["witsoc.target.v2", "witsoc.source-map.v2", "witsoc.obstruction.v2", "witsoc.candidate.v2"],
      "outputs": ["witsoc.target.v2", "witsoc.source-map.v2", "witsoc.obstruction.v2", "witsoc.candidate.v2"],
      "requires": [],
      "load": ["references/bridges.md", "references/explorer_cross_domain.md"],
      "commands": ["bash \"$WITSOC_ROOT/scripts/witsoc.sh\" bridge-negotiate-v2 --help", "bash \"$WITSOC_ROOT/scripts/witsoc.sh\" bridge-plan-v2 --help", "bash \"$WITSOC_ROOT/scripts/witsoc.sh\" bridge-translate-v2 --help", "bash \"$WITSOC_ROOT/scripts/witsoc.sh\" bridge-graph-v2 --help"],
      "cost_class": "small",
      "priority": 95
    },
    {
      "id": "research-memory",
      "summary": "Retrieve exact-scope admitted products, failures, routes, and obstructions.",
      "modes": ["OPEN_DISCOVERY", "REPAIR", "SOURCE_SYNTHESIS"],
      "roles": ["explorer", "generator", "researcher"],
      "default": false,
      "triggers": ["prior run", "memory", "repeat", "revival", "retained frontier"],
      "inputs": ["witsoc.target.v2", "witsoc.admission.v2"],
      "outputs": ["witsoc.capsule.v1", "witsoc.obstruction.v2"],
      "requires": [],
      "load": ["references/memory.md"],
      "commands": ["bash \"$WITSOC_ROOT/scripts/witsoc.sh\" memory-query --help"],
      "cost_class": "tiny",
      "priority": 70
    }
  ]
}
